{
  "version": "2026.10.2",
  "disclaimer": "Educational reference only. Never eat any wild plant, berry, or fungus based on an app. Confirm with a qualified local expert.",
  "universal_rules": [
    { "id": "no-app-confirmation", "applies_to": ["berry", "mushroom", "plant"], "text": "No wild mushroom is ever confirmed by an app; treat every mushroom ID as provisional until a qualified expert confirms it in person." },
    { "id": "edibility-test-myth", "applies_to": ["berry", "mushroom", "plant"], "text": "The so-called universal edibility test is a myth that kills; some deadly toxins take hours to act and are not detected by skin, lip, or tiny-taste steps." },
    { "id": "white-gills-ring-cup", "applies_to": ["mushroom"], "text": "White-gilled mushrooms with a ring on the stem and a cup at the base are treated as deadly Amanitas until proven otherwise." },
    { "id": "amatoxin-latency", "applies_to": ["mushroom", "berry", "plant"], "text": "Amatoxin poisoning has a deceptive 6–24 hour latent period where the victim feels better before liver failure begins." },
    { "id": "milky-sap", "applies_to": ["berry", "plant"], "text": "Never eat anything with milky sap unless positively identified by an expert; many milky-sapped plants are toxic." },
    { "id": "umbellifers-off-limits", "applies_to": ["plant"], "text": "Umbellifers (carrot family) are off-limits without expert confirmation: water hemlock and poison hemlock kill in small amounts and resemble edible relatives." },
    { "id": "elderberry-raw", "applies_to": ["berry"], "text": "Raw elderberry fruit, stems, leaves, and unripe fruit contain cyanogenic compounds; only cooked ripe fruit of verified species is used, and only with expert guidance." },
    { "id": "children-pets", "applies_to": ["berry", "mushroom", "plant"], "text": "Children and pets are at higher risk: smaller doses are dangerous, and attractive berries invite accidental ingestion. Supervise closely and teach no-taste rules." },
    { "id": "photograph-first", "applies_to": ["berry", "mushroom", "plant"], "text": "Photograph the whole organism, fruit or cap close-up, leaves or gills, and growth habit before touching anything." },
    { "id": "gloves-wash", "applies_to": ["berry", "mushroom", "plant"], "text": "Wear gloves around contact hazards (poison ivy, hogweed, nettles), avoid touching face, and wash hands, tools, and clothing afterward." },
    { "id": "one-specimen", "applies_to": ["berry", "mushroom", "plant"], "text": "Assess one specimen at a time; mixed patches and partial specimens cause the most dangerous misidentifications." },
    { "id": "cooking-myth", "applies_to": ["mushroom", "berry", "plant"], "text": "Cooking does not destroy amatoxins, many alkaloids, or cyanogenic compounds in pits and seeds; heat is not a safety test." }
  ],
  "species": [
    {
      "id": "lowbush-blueberry",
      "common_names": ["Lowbush blueberry"],
      "scientific_name": "Vaccinium angustifolium",
      "category": "berry",
      "edibility": "edible_with_caution",
      "toxicity_mechanism": "None when ripe and correctly identified; unripe fruit may cause mild gastrointestinal upset.",
      "regions": ["north-america"],
      "seasons": ["summer"],
      "habitat": "Acidic barrens, open woods, and hillsides in northeastern North America.",
      "visual_prompts": [
        "Whole lowbush blueberry shrub with small oval leaves and clusters of round dusty-blue berries",
        "Close-up of ripe round blue berries with a five-pointed crown calyx scar on a blueberry bush",
        "Detail of small oval finely toothed blueberry leaves, green in summer and red in autumn",
        "Low spreading blueberry barrens with many thin woody stems and bell-shaped white-pink flowers in spring"
      ],
      "verification_checklist": [
        "Berries are round, dusty blue with a pale waxy bloom",
        "Blossom end shows a five-pointed crown (calyx scar)",
        "Leaves are small, oval, finely toothed, alternate",
        "Shrub is low and spreading, not a vine and not thorny",
        "Flowers are small white-to-pink bells (in season)",
        "Berries grow on woody shrubs, not on herbaceous nightshade plants"
      ],
      "confusable_with": [
        { "species_id": "black-huckleberry", "how_to_tell_apart": "Huckleberry seeds are large and crunchy (10 seeds); blueberry seeds are tiny and soft. Both edible with caution — confusion is low-risk." },
        { "species_id": "deadly-nightshade", "how_to_tell_apart": "Nightshade berries are shiny black single berries on herbaceous plants with purple flowers, never dusty-blue with a crown scar." }
      ],
      "symptoms_if_ingested": "None expected for ripe fruit.",
      "onset": "N/A for ripe fruit.",
      "first_aid": ["Rinse mouth.", "Observe for symptoms.", "Contact poison control if identification is uncertain."],
      "contact_precautions": "None.",
      "notes": "Classic trail nibble, but only after every checklist item passes and lookalikes are excluded."
    },
    {
      "id": "black-huckleberry",
      "common_names": ["Black huckleberry"],
      "scientific_name": "Gaylussacia baccata",
      "category": "berry",
      "edibility": "edible_with_caution",
      "toxicity_mechanism": "None when ripe and correctly identified.",
      "regions": ["north-america"],
      "seasons": ["summer"],
      "habitat": "Oak woods, barrens, and moors of eastern North America.",
      "visual_prompts": [
        "Black huckleberry bush with glossy oval leaves and black berries",
        "Close-up of shiny black huckleberries without a strong waxy bloom",
        "Detail of huckleberry leaves with resinous golden dots underneath",
        "Upright branching huckleberry shrub in sandy oak woodland"
      ],
      "verification_checklist": [
        "Berries are black, glossy, less bloomy than blueberries",
        "Crushed berry reveals about ten large crunchy seeds",
        "Leaf undersides show tiny golden resin dots",
        "Shrub is upright and branching with shreddy bark",
        "Berries single in leaf axils rather than dense terminal clusters only",
        "No thorns, no milky sap"
      ],
      "confusable_with": [
        { "species_id": "lowbush-blueberry", "how_to_tell_apart": "Blueberry seeds are tiny; huckleberry seeds are large and crunchy. Both edible with caution." },
        { "species_id": "pokeweed", "how_to_tell_apart": "Pokeweed berries hang in long drooping racemes on smooth purple-red stalks of a tall herb, never on a woody shrub." }
      ],
      "symptoms_if_ingested": "None expected for ripe fruit.",
      "onset": "N/A for ripe fruit.",
      "first_aid": ["Rinse mouth.", "Save a sample if uncertain.", "Call poison control if any doubt."],
      "contact_precautions": "None.",
      "notes": "Distinguished from blueberry by seed crunch and resin-dotted leaves."
    },
    {
      "id": "allegheny-blackberry",
      "common_names": ["Allegheny blackberry", "Himalayan blackberry (lookalike)"],
      "scientific_name": "Rubus allegheniensis",
      "category": "berry",
      "edibility": "edible_with_caution",
      "toxicity_mechanism": "None when ripe and correctly identified; thorns cause mechanical injury.",
      "regions": ["north-america", "europe"],
      "seasons": ["summer"],
      "habitat": "Thickets, trail edges, and clearings; Himalayan blackberry (R. armeniacus) invasive in the west.",
      "visual_prompts": [
        "Arching thorny blackberry canes with compound leaves and clusters of black aggregate berries",
        "Close-up of ripe black aggregate berry composed of many small drupelets with a white core when picked",
        "Detail of palmately compound blackberry leaves with toothed leaflets and prickly stems",
        "Dense blackberry bramble thicket with white five-petaled flowers in early summer"
      ],
      "verification_checklist": [
        "Fruit is an aggregate of many small drupelets, black when fully ripe",
        "Picked berry retains a soft white core (unlike raspberry which is hollow)",
        "Stems are arching, angled, armed with stout prickles",
        "Leaves are compound with 3–5 toothed leaflets",
        "Unripe berries are red and hard — only eat fully black soft ones",
        "Flowers have five white petals (in season)"
      ],
      "confusable_with": [
        { "species_id": "black-raspberry", "how_to_tell_apart": "Black raspberry is hollow when picked (thimble-like); blackberry keeps its core. Both edible with caution." },
        { "species_id": "pokeweed", "how_to_tell_apart": "Pokeweed has smooth round purple-black berries in racemes on unarmed stalks, never aggregate drupelets on thorny canes." }
      ],
      "symptoms_if_ingested": "None expected for ripe fruit; unripe fruit may upset the stomach.",
      "onset": "N/A for ripe fruit.",
      "first_aid": ["Rinse mouth.", "Remove thorns and clean scratches.", "Call poison control if uncertain."],
      "contact_precautions": "Thorns scratch; wear gloves and long sleeves in brambles.",
      "notes": "Himalayan blackberry is a near-identical edible lookalike; both need the same checklist."
    },
    {
      "id": "red-raspberry",
      "common_names": ["Red raspberry"],
      "scientific_name": "Rubus idaeus",
      "category": "berry",
      "edibility": "edible_with_caution",
      "toxicity_mechanism": "None when ripe and correctly identified.",
      "regions": ["north-america", "europe", "uk-ireland"],
      "seasons": ["summer"],
      "habitat": "Cool woods edges, clearings, and disturbed ground across the north temperate zone.",
      "visual_prompts": [
        "Red raspberry canes with pinnate leaves and conical red aggregate berries",
        "Close-up of hollow red raspberry that slips off its white receptacle leaving a cup",
        "Detail of raspberry leaflets white-felty underneath with bristly prickles on stems",